{
  "schema_version": "sweep.accountability.v1",
  "sweep_id": "e29eae37-7ca4-47bf-bce9-d65a7177a633",
  "parent_sweep_id": null,
  "sweep_version": "v1",
  "iteration": 0,
  "mode": "CONTINUOUS",
  "scope": {
    "repository": "timerloggedout-spec/termux-monorepo",
    "ref": "master",
    "from": "",
    "to": "2026-10-21T00:17:01Z",
    "query": "event=pull_request; historical census when requested",
    "cursor": null,
    "sources": [
      "git://repository",
      "github://event/pull_request",
      "github://actions/39520320044"
    ]
  },
  "started_at": "2026-10-21T00:17:01Z",
  "completed_at": "2026-10-21T00:17:01Z",
  "status": "SUCCESS",
  "coverage": {
    "state": "COMPLETE",
    "observed": 3895,
    "expected": null,
    "next_cursor": null,
    "reason": "Git history is complete for the checked-out ref; external source census is explicit and retained when HISTORICAL mode is requested."
  },
  "provenance": {
    "actor_type": "workflow",
    "actor": "timerloggedout-spec",
    "tool": "GitHub Actions",
    "workflow": "Sweep Accountability",
    "run_id": "39520320044",
    "event": "pull_request",
    "source_refs": [
      "https://github.com/timerloggedout-spec/termux-monorepo/actions/runs/39520320044"
    ],
    "source_shas": [
      "6862295f242c67015595d80185518a5d90d0ed50",
      "ebe3e0ca504cb35ef61832b0b1b1576a1a0d44fb"
    ],
    "input_sha256": "cced88540a5c3f4c6fb0162a231182d3120ad22fa55448ff4c809d7dafc4eff3"
  },
  "findings": [
    {
      "id": "repository-head",
      "classification": "OBSERVED",
      "statement": "HEAD=6862295f242c67015595d80185518a5d90d0ed50",
      "evidence_refs": [
        "git://commit/6862295f242c67015595d80185518a5d90d0ed50"
      ],
      "confidence": 1
    },
    {
      "id": "repository-commit-count",
      "classification": "OBSERVED",
      "statement": "reachable commits=3895",
      "evidence_refs": [
        "git://rev-list"
      ],
      "confidence": 1
    },
    {
      "id": "trigger-event",
      "classification": "OBSERVED",
      "statement": "sweep trigger=pull_request",
      "evidence_refs": [
        "github://event"
      ],
      "confidence": 1
    }
  ],
  "actions": [
    {
      "id": "sweep-39520320044",
      "type": "accountability-sweep",
      "status": "SUCCEEDED",
      "actor": "timerloggedout-spec",
      "tool": "GitHub Actions",
      "target": "timerloggedout-spec/termux-monorepo"
    }
  ],
  "effects": [
    {
      "id": "effect-39520320044",
      "type": "accountability-receipt",
      "after": {
        "head_sha": "6862295f242c67015595d80185518a5d90d0ed50",
        "reachable_commits": 3895,
        "trigger_event": "pull_request",
        "run_url": "https://github.com/timerloggedout-spec/termux-monorepo/actions/runs/39520320044"
      }
    }
  ],
  "errors": [],
  "next": {
    "sweep_version": "v1",
    "iteration": 1,
    "cursor": null,
    "start": "2026-10-21T00:17:01Z"
  }
}
