{
  "schema_version": "sweep.accountability.v1",
  "sweep_id": "8de707aa-c5c4-4b6c-b0f9-dfaa946eca85",
  "parent_sweep_id": null,
  "sweep_version": "v1",
  "iteration": 0,
  "mode": "CONTINUOUS",
  "scope": {
    "repository": "timerloggedout-spec/termux-monorepo",
    "ref": "master",
    "from": "",
    "to": "2026-10-03T16:20:30Z",
    "query": "event=issue_comment; historical census when requested",
    "cursor": null,
    "sources": [
      "git://repository",
      "github://event/issue_comment",
      "github://actions/37136458766"
    ]
  },
  "started_at": "2026-10-03T16:20:30Z",
  "completed_at": "2026-10-03T16:20:30Z",
  "status": "SUCCESS",
  "coverage": {
    "state": "COMPLETE",
    "observed": 2213,
    "expected": null,
    "next_cursor": null,
    "reason": "Git history is complete for the checked-out ref; external source census is explicit and retained when HISTORICAL mode is requested."
  },
  "provenance": {
    "actor_type": "workflow",
    "actor": "blocksorg[bot]",
    "tool": "GitHub Actions",
    "workflow": "Sweep Accountability",
    "run_id": "37136458766",
    "event": "issue_comment",
    "source_refs": [
      "https://github.com/timerloggedout-spec/termux-monorepo/actions/runs/37136458766"
    ],
    "source_shas": [
      "c4ade3f0be20e23f271588eaaaf3c8af0430c725",
      "ebe3e0ca504cb35ef61832b0b1b1576a1a0d44fb"
    ],
    "input_sha256": "78fbd8ec483e7cf6ff926e2307511e6ac02600252e025ed554dee39b79336841"
  },
  "findings": [
    {
      "id": "repository-head",
      "classification": "OBSERVED",
      "statement": "HEAD=c4ade3f0be20e23f271588eaaaf3c8af0430c725",
      "evidence_refs": [
        "git://commit/c4ade3f0be20e23f271588eaaaf3c8af0430c725"
      ],
      "confidence": 1
    },
    {
      "id": "repository-commit-count",
      "classification": "OBSERVED",
      "statement": "reachable commits=2213",
      "evidence_refs": [
        "git://rev-list"
      ],
      "confidence": 1
    },
    {
      "id": "trigger-event",
      "classification": "OBSERVED",
      "statement": "sweep trigger=issue_comment",
      "evidence_refs": [
        "github://event"
      ],
      "confidence": 1
    }
  ],
  "actions": [
    {
      "id": "sweep-37136458766",
      "type": "accountability-sweep",
      "status": "SUCCEEDED",
      "actor": "blocksorg[bot]",
      "tool": "GitHub Actions",
      "target": "timerloggedout-spec/termux-monorepo"
    }
  ],
  "effects": [
    {
      "id": "effect-37136458766",
      "type": "accountability-receipt",
      "after": {
        "head_sha": "c4ade3f0be20e23f271588eaaaf3c8af0430c725",
        "reachable_commits": 2213,
        "trigger_event": "issue_comment",
        "run_url": "https://github.com/timerloggedout-spec/termux-monorepo/actions/runs/37136458766"
      }
    }
  ],
  "errors": [],
  "next": {
    "sweep_version": "v1",
    "iteration": 1,
    "cursor": null,
    "start": "2026-10-03T16:20:30Z"
  }
}
