{
  "schema_version": "sweep.accountability.v1",
  "sweep_id": "641726e4-87c1-47ec-80ee-47a0b8a85ce2",
  "parent_sweep_id": null,
  "sweep_version": "v1",
  "iteration": 0,
  "mode": "CONTINUOUS",
  "scope": {
    "repository": "timerloggedout-spec/termux-monorepo",
    "ref": "master",
    "from": "",
    "to": "2026-10-05T14:11:22Z",
    "query": "event=issue_comment; historical census when requested",
    "cursor": null,
    "sources": [
      "git://repository",
      "github://event/issue_comment",
      "github://actions/37322646342"
    ]
  },
  "started_at": "2026-10-05T14:11:22Z",
  "completed_at": "2026-10-05T14:11:22Z",
  "status": "SUCCESS",
  "coverage": {
    "state": "COMPLETE",
    "observed": 2790,
    "expected": null,
    "next_cursor": null,
    "reason": "Git history is complete for the checked-out ref; external source census is explicit and retained when HISTORICAL mode is requested."
  },
  "provenance": {
    "actor_type": "workflow",
    "actor": "coderabbitai[bot]",
    "tool": "GitHub Actions",
    "workflow": "Sweep Accountability",
    "run_id": "37322646342",
    "event": "issue_comment",
    "source_refs": [
      "https://github.com/timerloggedout-spec/termux-monorepo/actions/runs/37322646342"
    ],
    "source_shas": [
      "d6672d604af7d0674dd49563c21d3f33223de7ad",
      "ebe3e0ca504cb35ef61832b0b1b1576a1a0d44fb"
    ],
    "input_sha256": "cc6be124a1515116d230303d0d6a92d1df14c7c62e239b1f8af205d09304a622"
  },
  "findings": [
    {
      "id": "repository-head",
      "classification": "OBSERVED",
      "statement": "HEAD=d6672d604af7d0674dd49563c21d3f33223de7ad",
      "evidence_refs": [
        "git://commit/d6672d604af7d0674dd49563c21d3f33223de7ad"
      ],
      "confidence": 1
    },
    {
      "id": "repository-commit-count",
      "classification": "OBSERVED",
      "statement": "reachable commits=2790",
      "evidence_refs": [
        "git://rev-list"
      ],
      "confidence": 1
    },
    {
      "id": "trigger-event",
      "classification": "OBSERVED",
      "statement": "sweep trigger=issue_comment",
      "evidence_refs": [
        "github://event"
      ],
      "confidence": 1
    }
  ],
  "actions": [
    {
      "id": "sweep-37322646342",
      "type": "accountability-sweep",
      "status": "SUCCEEDED",
      "actor": "coderabbitai[bot]",
      "tool": "GitHub Actions",
      "target": "timerloggedout-spec/termux-monorepo"
    }
  ],
  "effects": [
    {
      "id": "effect-37322646342",
      "type": "accountability-receipt",
      "after": {
        "head_sha": "d6672d604af7d0674dd49563c21d3f33223de7ad",
        "reachable_commits": 2790,
        "trigger_event": "issue_comment",
        "run_url": "https://github.com/timerloggedout-spec/termux-monorepo/actions/runs/37322646342"
      }
    }
  ],
  "errors": [],
  "next": {
    "sweep_version": "v1",
    "iteration": 1,
    "cursor": null,
    "start": "2026-10-05T14:11:22Z"
  }
}
