{
  "schema_version": "sweep.accountability.v1",
  "sweep_id": "72e40aa3-5b86-4959-a6d6-5931b04bc468",
  "parent_sweep_id": null,
  "sweep_version": "v1",
  "iteration": 0,
  "mode": "CONTINUOUS",
  "scope": {
    "repository": "timerloggedout-spec/termux-monorepo",
    "ref": "master",
    "from": "",
    "to": "2026-10-27T12:42:40Z",
    "query": "event=push; historical census when requested",
    "cursor": null,
    "sources": [
      "git://repository",
      "github://event/push",
      "github://actions/40505879744"
    ]
  },
  "started_at": "2026-10-27T12:42:40Z",
  "completed_at": "2026-10-27T12:42:40Z",
  "status": "SUCCESS",
  "coverage": {
    "state": "COMPLETE",
    "observed": 5090,
    "expected": null,
    "next_cursor": null,
    "reason": "Git history is complete for the checked-out ref; external source census is explicit and retained when HISTORICAL mode is requested."
  },
  "provenance": {
    "actor_type": "workflow",
    "actor": "timerloggedout-spec",
    "tool": "GitHub Actions",
    "workflow": "Sweep Accountability",
    "run_id": "40505879744",
    "event": "push",
    "source_refs": [
      "https://github.com/timerloggedout-spec/termux-monorepo/actions/runs/40505879744"
    ],
    "source_shas": [
      "6fe2c2280e3446e1220c9ff727e7ce4f788bf96a",
      "ebe3e0ca504cb35ef61832b0b1b1576a1a0d44fb"
    ],
    "input_sha256": "15b5bdd637a5e78cb8b4a4ce2c760919a7b073707e619b3fdc99cf8607a65992"
  },
  "findings": [
    {
      "id": "repository-head",
      "classification": "OBSERVED",
      "statement": "HEAD=6fe2c2280e3446e1220c9ff727e7ce4f788bf96a",
      "evidence_refs": [
        "git://commit/6fe2c2280e3446e1220c9ff727e7ce4f788bf96a"
      ],
      "confidence": 1
    },
    {
      "id": "repository-commit-count",
      "classification": "OBSERVED",
      "statement": "reachable commits=5090",
      "evidence_refs": [
        "git://rev-list"
      ],
      "confidence": 1
    },
    {
      "id": "trigger-event",
      "classification": "OBSERVED",
      "statement": "sweep trigger=push",
      "evidence_refs": [
        "github://event"
      ],
      "confidence": 1
    }
  ],
  "actions": [
    {
      "id": "sweep-40505879744",
      "type": "accountability-sweep",
      "status": "SUCCEEDED",
      "actor": "timerloggedout-spec",
      "tool": "GitHub Actions",
      "target": "timerloggedout-spec/termux-monorepo"
    }
  ],
  "effects": [
    {
      "id": "effect-40505879744",
      "type": "accountability-receipt",
      "after": {
        "head_sha": "6fe2c2280e3446e1220c9ff727e7ce4f788bf96a",
        "reachable_commits": 5090,
        "trigger_event": "push",
        "run_url": "https://github.com/timerloggedout-spec/termux-monorepo/actions/runs/40505879744"
      }
    }
  ],
  "errors": [],
  "next": {
    "sweep_version": "v1",
    "iteration": 1,
    "cursor": null,
    "start": "2026-10-27T12:42:40Z"
  }
}
