{
  "schema_version": "sweep.accountability.v1",
  "sweep_id": "da940b5c-3449-499a-bbfd-092d99ce5fd8",
  "parent_sweep_id": null,
  "sweep_version": "v1",
  "iteration": 0,
  "mode": "CONTINUOUS",
  "scope": {
    "repository": "timerloggedout-spec/termux-monorepo",
    "ref": "master",
    "from": "",
    "to": "2026-10-06T07:04:55Z",
    "query": "event=issue_comment; historical census when requested",
    "cursor": null,
    "sources": [
      "git://repository",
      "github://event/issue_comment",
      "github://actions/37427432698"
    ]
  },
  "started_at": "2026-10-06T07:04:55Z",
  "completed_at": "2026-10-06T07:04:55Z",
  "status": "SUCCESS",
  "coverage": {
    "state": "COMPLETE",
    "observed": 2910,
    "expected": null,
    "next_cursor": null,
    "reason": "Git history is complete for the checked-out ref; external source census is explicit and retained when HISTORICAL mode is requested."
  },
  "provenance": {
    "actor_type": "workflow",
    "actor": "vercel[bot]",
    "tool": "GitHub Actions",
    "workflow": "Sweep Accountability",
    "run_id": "37427432698",
    "event": "issue_comment",
    "source_refs": [
      "https://github.com/timerloggedout-spec/termux-monorepo/actions/runs/37427432698"
    ],
    "source_shas": [
      "99c22cafd59a2d4a8fbe169975d82fae74621066",
      "ebe3e0ca504cb35ef61832b0b1b1576a1a0d44fb"
    ],
    "input_sha256": "11aad52218417a8a5cc3108d7d4d851a710ec0c857aea30c591acf5b2c67d29b"
  },
  "findings": [
    {
      "id": "repository-head",
      "classification": "OBSERVED",
      "statement": "HEAD=99c22cafd59a2d4a8fbe169975d82fae74621066",
      "evidence_refs": [
        "git://commit/99c22cafd59a2d4a8fbe169975d82fae74621066"
      ],
      "confidence": 1
    },
    {
      "id": "repository-commit-count",
      "classification": "OBSERVED",
      "statement": "reachable commits=2910",
      "evidence_refs": [
        "git://rev-list"
      ],
      "confidence": 1
    },
    {
      "id": "trigger-event",
      "classification": "OBSERVED",
      "statement": "sweep trigger=issue_comment",
      "evidence_refs": [
        "github://event"
      ],
      "confidence": 1
    }
  ],
  "actions": [
    {
      "id": "sweep-37427432698",
      "type": "accountability-sweep",
      "status": "SUCCEEDED",
      "actor": "vercel[bot]",
      "tool": "GitHub Actions",
      "target": "timerloggedout-spec/termux-monorepo"
    }
  ],
  "effects": [
    {
      "id": "effect-37427432698",
      "type": "accountability-receipt",
      "after": {
        "head_sha": "99c22cafd59a2d4a8fbe169975d82fae74621066",
        "reachable_commits": 2910,
        "trigger_event": "issue_comment",
        "run_url": "https://github.com/timerloggedout-spec/termux-monorepo/actions/runs/37427432698"
      }
    }
  ],
  "errors": [],
  "next": {
    "sweep_version": "v1",
    "iteration": 1,
    "cursor": null,
    "start": "2026-10-06T07:04:55Z"
  }
}
