{
  "schema_version": "sweep.accountability.v1",
  "sweep_id": "32250440-0050-49e1-ab28-4ef92cb84d6a",
  "parent_sweep_id": null,
  "sweep_version": "v1",
  "iteration": 0,
  "mode": "CONTINUOUS",
  "scope": {
    "repository": "timerloggedout-spec/termux-monorepo",
    "ref": "master",
    "from": "",
    "to": "2026-10-05T00:25:57Z",
    "query": "event=issues; historical census when requested",
    "cursor": null,
    "sources": [
      "git://repository",
      "github://event/issues",
      "github://actions/37247466279"
    ]
  },
  "started_at": "2026-10-05T00:25:57Z",
  "completed_at": "2026-10-05T00:25:57Z",
  "status": "SUCCESS",
  "coverage": {
    "state": "COMPLETE",
    "observed": 2678,
    "expected": null,
    "next_cursor": null,
    "reason": "Git history is complete for the checked-out ref; external source census is explicit and retained when HISTORICAL mode is requested."
  },
  "provenance": {
    "actor_type": "workflow",
    "actor": "timerloggedout-spec",
    "tool": "GitHub Actions",
    "workflow": "Sweep Accountability",
    "run_id": "37247466279",
    "event": "issues",
    "source_refs": [
      "https://github.com/timerloggedout-spec/termux-monorepo/actions/runs/37247466279"
    ],
    "source_shas": [
      "c935a2d571cb09c675c91115142acd835c55919b",
      "ebe3e0ca504cb35ef61832b0b1b1576a1a0d44fb"
    ],
    "input_sha256": "0d637908ed0cd91558eec4f52807f6799509ca5fe15ed4132f99f431151d9f2c"
  },
  "findings": [
    {
      "id": "repository-head",
      "classification": "OBSERVED",
      "statement": "HEAD=c935a2d571cb09c675c91115142acd835c55919b",
      "evidence_refs": [
        "git://commit/c935a2d571cb09c675c91115142acd835c55919b"
      ],
      "confidence": 1
    },
    {
      "id": "repository-commit-count",
      "classification": "OBSERVED",
      "statement": "reachable commits=2678",
      "evidence_refs": [
        "git://rev-list"
      ],
      "confidence": 1
    },
    {
      "id": "trigger-event",
      "classification": "OBSERVED",
      "statement": "sweep trigger=issues",
      "evidence_refs": [
        "github://event"
      ],
      "confidence": 1
    }
  ],
  "actions": [
    {
      "id": "sweep-37247466279",
      "type": "accountability-sweep",
      "status": "SUCCEEDED",
      "actor": "timerloggedout-spec",
      "tool": "GitHub Actions",
      "target": "timerloggedout-spec/termux-monorepo"
    }
  ],
  "effects": [
    {
      "id": "effect-37247466279",
      "type": "accountability-receipt",
      "after": {
        "head_sha": "c935a2d571cb09c675c91115142acd835c55919b",
        "reachable_commits": 2678,
        "trigger_event": "issues",
        "run_url": "https://github.com/timerloggedout-spec/termux-monorepo/actions/runs/37247466279"
      }
    }
  ],
  "errors": [],
  "next": {
    "sweep_version": "v1",
    "iteration": 1,
    "cursor": null,
    "start": "2026-10-05T00:25:57Z"
  }
}
