{
  "schema_version": "sweep.accountability.v1",
  "sweep_id": "00db4634-83ad-4a20-a07e-db1bdf576f37",
  "parent_sweep_id": null,
  "sweep_version": "v1",
  "iteration": 0,
  "mode": "CONTINUOUS",
  "scope": {
    "repository": "timerloggedout-spec/termux-monorepo",
    "ref": "master",
    "from": "",
    "to": "2026-10-03T18:20:09Z",
    "query": "event=issue_comment; historical census when requested",
    "cursor": null,
    "sources": [
      "git://repository",
      "github://event/issue_comment",
      "github://actions/37143721818"
    ]
  },
  "started_at": "2026-10-03T18:20:09Z",
  "completed_at": "2026-10-03T18:20:09Z",
  "status": "SUCCESS",
  "coverage": {
    "state": "COMPLETE",
    "observed": 2260,
    "expected": null,
    "next_cursor": null,
    "reason": "Git history is complete for the checked-out ref; external source census is explicit and retained when HISTORICAL mode is requested."
  },
  "provenance": {
    "actor_type": "workflow",
    "actor": "ecc-tools[bot]",
    "tool": "GitHub Actions",
    "workflow": "Sweep Accountability",
    "run_id": "37143721818",
    "event": "issue_comment",
    "source_refs": [
      "https://github.com/timerloggedout-spec/termux-monorepo/actions/runs/37143721818"
    ],
    "source_shas": [
      "89ecf5bb119acb8b9fe1ce4d132f693ecd3a082a",
      "ebe3e0ca504cb35ef61832b0b1b1576a1a0d44fb"
    ],
    "input_sha256": "1a2ecf683fd2c61510650e9c611abb0194ad3e58c362d9c5a5c8772a1554bb19"
  },
  "findings": [
    {
      "id": "repository-head",
      "classification": "OBSERVED",
      "statement": "HEAD=89ecf5bb119acb8b9fe1ce4d132f693ecd3a082a",
      "evidence_refs": [
        "git://commit/89ecf5bb119acb8b9fe1ce4d132f693ecd3a082a"
      ],
      "confidence": 1
    },
    {
      "id": "repository-commit-count",
      "classification": "OBSERVED",
      "statement": "reachable commits=2260",
      "evidence_refs": [
        "git://rev-list"
      ],
      "confidence": 1
    },
    {
      "id": "trigger-event",
      "classification": "OBSERVED",
      "statement": "sweep trigger=issue_comment",
      "evidence_refs": [
        "github://event"
      ],
      "confidence": 1
    }
  ],
  "actions": [
    {
      "id": "sweep-37143721818",
      "type": "accountability-sweep",
      "status": "SUCCEEDED",
      "actor": "ecc-tools[bot]",
      "tool": "GitHub Actions",
      "target": "timerloggedout-spec/termux-monorepo"
    }
  ],
  "effects": [
    {
      "id": "effect-37143721818",
      "type": "accountability-receipt",
      "after": {
        "head_sha": "89ecf5bb119acb8b9fe1ce4d132f693ecd3a082a",
        "reachable_commits": 2260,
        "trigger_event": "issue_comment",
        "run_url": "https://github.com/timerloggedout-spec/termux-monorepo/actions/runs/37143721818"
      }
    }
  ],
  "errors": [],
  "next": {
    "sweep_version": "v1",
    "iteration": 1,
    "cursor": null,
    "start": "2026-10-03T18:20:09Z"
  }
}
