{
  "schema_version": "sweep.accountability.v1",
  "sweep_id": "802d4dfe-0518-4dd9-8e62-6ae85dbcc0ac",
  "parent_sweep_id": null,
  "sweep_version": "v1",
  "iteration": 0,
  "mode": "CONTINUOUS",
  "scope": {
    "repository": "timerloggedout-spec/termux-monorepo",
    "ref": "master",
    "from": "",
    "to": "2026-10-05T22:33:36Z",
    "query": "event=issue_comment; historical census when requested",
    "cursor": null,
    "sources": [
      "git://repository",
      "github://event/issue_comment",
      "github://actions/37383218277"
    ]
  },
  "started_at": "2026-10-05T22:33:36Z",
  "completed_at": "2026-10-05T22:33:36Z",
  "status": "SUCCESS",
  "coverage": {
    "state": "COMPLETE",
    "observed": 2847,
    "expected": null,
    "next_cursor": null,
    "reason": "Git history is complete for the checked-out ref; external source census is explicit and retained when HISTORICAL mode is requested."
  },
  "provenance": {
    "actor_type": "workflow",
    "actor": "google-labs-jules[bot]",
    "tool": "GitHub Actions",
    "workflow": "Sweep Accountability",
    "run_id": "37383218277",
    "event": "issue_comment",
    "source_refs": [
      "https://github.com/timerloggedout-spec/termux-monorepo/actions/runs/37383218277"
    ],
    "source_shas": [
      "ce26bf9b203630e2c6ee6e58e70d633bca002909",
      "ebe3e0ca504cb35ef61832b0b1b1576a1a0d44fb"
    ],
    "input_sha256": "d5c467486dbd85cd1804b467cc5057fd093f1327a2f0e6651ad02d773e6d04d8"
  },
  "findings": [
    {
      "id": "repository-head",
      "classification": "OBSERVED",
      "statement": "HEAD=ce26bf9b203630e2c6ee6e58e70d633bca002909",
      "evidence_refs": [
        "git://commit/ce26bf9b203630e2c6ee6e58e70d633bca002909"
      ],
      "confidence": 1
    },
    {
      "id": "repository-commit-count",
      "classification": "OBSERVED",
      "statement": "reachable commits=2847",
      "evidence_refs": [
        "git://rev-list"
      ],
      "confidence": 1
    },
    {
      "id": "trigger-event",
      "classification": "OBSERVED",
      "statement": "sweep trigger=issue_comment",
      "evidence_refs": [
        "github://event"
      ],
      "confidence": 1
    }
  ],
  "actions": [
    {
      "id": "sweep-37383218277",
      "type": "accountability-sweep",
      "status": "SUCCEEDED",
      "actor": "google-labs-jules[bot]",
      "tool": "GitHub Actions",
      "target": "timerloggedout-spec/termux-monorepo"
    }
  ],
  "effects": [
    {
      "id": "effect-37383218277",
      "type": "accountability-receipt",
      "after": {
        "head_sha": "ce26bf9b203630e2c6ee6e58e70d633bca002909",
        "reachable_commits": 2847,
        "trigger_event": "issue_comment",
        "run_url": "https://github.com/timerloggedout-spec/termux-monorepo/actions/runs/37383218277"
      }
    }
  ],
  "errors": [],
  "next": {
    "sweep_version": "v1",
    "iteration": 1,
    "cursor": null,
    "start": "2026-10-05T22:33:36Z"
  }
}
