{
  "schema_version": "sweep.accountability.v1",
  "sweep_id": "87411a15-48a4-41ca-a80d-5cc2c341c366",
  "parent_sweep_id": null,
  "sweep_version": "v1",
  "iteration": 0,
  "mode": "CONTINUOUS",
  "scope": {
    "repository": "timerloggedout-spec/termux-monorepo",
    "ref": "master",
    "from": "",
    "to": "2026-10-03T15:56:27Z",
    "query": "event=issue_comment; historical census when requested",
    "cursor": null,
    "sources": [
      "git://repository",
      "github://event/issue_comment",
      "github://actions/37135005601"
    ]
  },
  "started_at": "2026-10-03T15:56:28Z",
  "completed_at": "2026-10-03T15:56:28Z",
  "status": "SUCCESS",
  "coverage": {
    "state": "COMPLETE",
    "observed": 2205,
    "expected": null,
    "next_cursor": null,
    "reason": "Git history is complete for the checked-out ref; external source census is explicit and retained when HISTORICAL mode is requested."
  },
  "provenance": {
    "actor_type": "workflow",
    "actor": "gitar-bot[bot]",
    "tool": "GitHub Actions",
    "workflow": "Sweep Accountability",
    "run_id": "37135005601",
    "event": "issue_comment",
    "source_refs": [
      "https://github.com/timerloggedout-spec/termux-monorepo/actions/runs/37135005601"
    ],
    "source_shas": [
      "1e18f4f50f468de1d86af6981243e83719c3b76e",
      "ebe3e0ca504cb35ef61832b0b1b1576a1a0d44fb"
    ],
    "input_sha256": "60418ca5e54cb593cda0bb5803e96449140354d54c61dcb4395edb44004048cc"
  },
  "findings": [
    {
      "id": "repository-head",
      "classification": "OBSERVED",
      "statement": "HEAD=1e18f4f50f468de1d86af6981243e83719c3b76e",
      "evidence_refs": [
        "git://commit/1e18f4f50f468de1d86af6981243e83719c3b76e"
      ],
      "confidence": 1
    },
    {
      "id": "repository-commit-count",
      "classification": "OBSERVED",
      "statement": "reachable commits=2205",
      "evidence_refs": [
        "git://rev-list"
      ],
      "confidence": 1
    },
    {
      "id": "trigger-event",
      "classification": "OBSERVED",
      "statement": "sweep trigger=issue_comment",
      "evidence_refs": [
        "github://event"
      ],
      "confidence": 1
    }
  ],
  "actions": [
    {
      "id": "sweep-37135005601",
      "type": "accountability-sweep",
      "status": "SUCCEEDED",
      "actor": "gitar-bot[bot]",
      "tool": "GitHub Actions",
      "target": "timerloggedout-spec/termux-monorepo"
    }
  ],
  "effects": [
    {
      "id": "effect-37135005601",
      "type": "accountability-receipt",
      "after": {
        "head_sha": "1e18f4f50f468de1d86af6981243e83719c3b76e",
        "reachable_commits": 2205,
        "trigger_event": "issue_comment",
        "run_url": "https://github.com/timerloggedout-spec/termux-monorepo/actions/runs/37135005601"
      }
    }
  ],
  "errors": [],
  "next": {
    "sweep_version": "v1",
    "iteration": 1,
    "cursor": null,
    "start": "2026-10-03T15:56:27Z"
  }
}
