{
  "schema_version": "sweep.accountability.v1",
  "sweep_id": "327e7532-fa7a-4e00-bfe3-edbc051e5372",
  "parent_sweep_id": null,
  "sweep_version": "v1",
  "iteration": 0,
  "mode": "CONTINUOUS",
  "scope": {
    "repository": "timerloggedout-spec/termux-monorepo",
    "ref": "master",
    "from": "",
    "to": "2026-10-05T07:50:05Z",
    "query": "event=issue_comment; historical census when requested",
    "cursor": null,
    "sources": [
      "git://repository",
      "github://event/issue_comment",
      "github://actions/37279873265"
    ]
  },
  "started_at": "2026-10-05T07:50:06Z",
  "completed_at": "2026-10-05T07:50:06Z",
  "status": "SUCCESS",
  "coverage": {
    "state": "COMPLETE",
    "observed": 2745,
    "expected": null,
    "next_cursor": null,
    "reason": "Git history is complete for the checked-out ref; external source census is explicit and retained when HISTORICAL mode is requested."
  },
  "provenance": {
    "actor_type": "workflow",
    "actor": "timerloggedout-spec",
    "tool": "GitHub Actions",
    "workflow": "Sweep Accountability",
    "run_id": "37279873265",
    "event": "issue_comment",
    "source_refs": [
      "https://github.com/timerloggedout-spec/termux-monorepo/actions/runs/37279873265"
    ],
    "source_shas": [
      "2a3eb01178ca2fa8213204ce8fa823b8926001d0",
      "ebe3e0ca504cb35ef61832b0b1b1576a1a0d44fb"
    ],
    "input_sha256": "8424a3812c84425a180419cca4e317d22722585c7f60de0a860dcee101885e02"
  },
  "findings": [
    {
      "id": "repository-head",
      "classification": "OBSERVED",
      "statement": "HEAD=2a3eb01178ca2fa8213204ce8fa823b8926001d0",
      "evidence_refs": [
        "git://commit/2a3eb01178ca2fa8213204ce8fa823b8926001d0"
      ],
      "confidence": 1
    },
    {
      "id": "repository-commit-count",
      "classification": "OBSERVED",
      "statement": "reachable commits=2745",
      "evidence_refs": [
        "git://rev-list"
      ],
      "confidence": 1
    },
    {
      "id": "trigger-event",
      "classification": "OBSERVED",
      "statement": "sweep trigger=issue_comment",
      "evidence_refs": [
        "github://event"
      ],
      "confidence": 1
    }
  ],
  "actions": [
    {
      "id": "sweep-37279873265",
      "type": "accountability-sweep",
      "status": "SUCCEEDED",
      "actor": "timerloggedout-spec",
      "tool": "GitHub Actions",
      "target": "timerloggedout-spec/termux-monorepo"
    }
  ],
  "effects": [
    {
      "id": "effect-37279873265",
      "type": "accountability-receipt",
      "after": {
        "head_sha": "2a3eb01178ca2fa8213204ce8fa823b8926001d0",
        "reachable_commits": 2745,
        "trigger_event": "issue_comment",
        "run_url": "https://github.com/timerloggedout-spec/termux-monorepo/actions/runs/37279873265"
      }
    }
  ],
  "errors": [],
  "next": {
    "sweep_version": "v1",
    "iteration": 1,
    "cursor": null,
    "start": "2026-10-05T07:50:05Z"
  }
}
